{
  "version": "0.1.0",
  "task_id": "operator-review-remediation-v010",
  "read": [
    "AGENTS.md",
    "package.json",
    "src/core/operator-runtime.ts",
    "src/plugin/profiled.ts",
    "src/runtime-assets-v010.ts",
    "src/asset-version.ts",
    "scripts/run-v010-qualification.mjs",
    "test/fixtures/frontierharness-local/run-local-case-study.mjs",
    "test/frontierharness-local.test.ts",
    "test/v010-runtime.test.ts",
    "test/v010-qualification-script.test.ts",
    "test/initialize.test.ts",
    "test/plugin-loader.test.ts",
    "docs/v010-preview.md"
  ],
  "write": [
    "operation-manifest.json",
    "src/core/operator-runtime.ts",
    "src/plugin/profiled.ts",
    "src/runtime-assets-v010.ts",
    "src/asset-version.ts",
    "scripts/run-v010-qualification.mjs",
    "test/fixtures/frontierharness-local/run-local-case-study.mjs",
    "test/frontierharness-local.test.ts",
    "test/v010-runtime.test.ts",
    "test/v010-qualification-script.test.ts",
    "test/initialize.test.ts",
    "test/plugin-loader.test.ts",
    "docs/v010-preview.md"
  ],
  "validation": [
    "npm run build",
    "node --experimental-strip-types --import ./test/setup.ts --test test/v010-runtime.test.ts test/frontierharness-local.test.ts test/v010-qualification-script.test.ts test/initialize.test.ts test/plugin-loader.test.ts",
    "npm test",
    "git diff --check"
  ]
}
